{
 "hanzi": "父亲",
 "pinyin": "fù qīn",
 "meaning_ru": "отец (уважительно, формально)",
 "meaning_en": "father (formal / respectful term)",
 "characters": [
  {
   "hz": "父",
   "py": "fù",
   "gloss": "отец",
   "role": "смысловая основа"
  },
  {
   "hz": "亲",
   "py": "qīn",
   "gloss": "родной, близкий",
   "role": "родство, кровь"
  }
 ],
 "radicals": [
  {
   "hz": "父",
   "name": "fù — отец",
   "note": "Есть народная трактовка, что 父 рисует руку, держащую палку или топор — глава семьи, добытчик и наставник. Хороший образ, чтобы запомнить «отца»"
  }
 ],
 "deep_dive": "<p>父亲 — это <strong>уважительное и письменное</strong> «отец»: так напишут в анкете, скажут на людях, в торжественной речи. Тепло, но с дистанцией — почти как русское «отец» против «папа».</p><p>Дома же ребёнок зовёт его <strong>爸爸</strong> (bàba) — вот это уже «папа», своё, родное. 亲 здесь — «родной по крови»; тот же иероглиф в 母亲 (mǔqīn, мать) и 亲人 (родные).</p>",
 "situations": [
  {
   "title": "🏮 Формально",
   "setup": "Рассказываешь о семье уважительно.",
   "line": "我的父亲是老师。 — «Мой отец — учитель.»"
  }
 ],
 "examples": [
  {
   "cn": "我的{hl}父亲{/hl}是老师。",
   "py": "wǒ de fùqīn shì lǎoshī.",
   "ru": "Мой отец — учитель.",
   "note": "老师 (lǎoshī) — учитель"
  },
  {
   "cn": "他很爱自己的{hl}父亲{/hl}。",
   "py": "tā hěn ài zìjǐ de fùqīn.",
   "ru": "Он очень любит своего отца.",
   "note": "自己 (zìjǐ) — свой, сам"
  },
  {
   "cn": "{hl}父亲{/hl}的生日快到了。",
   "py": "fùqīn de shēngrì kuài dào le.",
   "ru": "Скоро день рождения отца.",
   "note": "生日 (shēngrì) — день рождения"
  }
 ],
 "footer_note": "父亲 — уважительное «отец»; дома — 爸爸 (папа) · HSK 4 (hsk2.0-L4)"
}
