{
  "hanzi": "默默",
  "pinyin": "mò mò",
  "meaning_ru": "молча, в тишине; тихо, незаметно для других",
  "meaning_en": "in silence, quietly; without a word — often implies quiet endurance or unrecognized effort",
  "deep_dive": "<p>默默 — редупликация 默 (молчать). Не просто «без слов», а с оттенком <strong>тихого самопожертвования или упорного труда без чьего-либо внимания</strong>. Классическое сочетание — 默默无闻 (mò mò wú wén): «молча и безызвестно» — про человека, который делает важное дело, но никто не замечает.</p><p>Эмоционально это слово тёплое и немного меланхоличное. «Он молча любил её всю жизнь», «она молча поддерживала семью» — именно для таких образов и нужно 默默. Это не безразличие, а <strong>молчаливая преданность</strong>.</p>",
  "situations": [
    {
      "title": "✦ Молчаливая поддержка",
      "setup": "Друг не говорит слов, но всегда рядом.",
      "line": "他默默地陪在我身边。 — «Он молча был рядом со мной.»"
    },
    {
      "title": "☁ Труд без признания",
      "setup": "Говорят о человеке, который много делает, но его не замечают.",
      "line": "她默默地工作了二十年。 — «Она тихо работала двадцать лет.»"
    }
  ],
  "examples": [
    {
      "cn": "他{hl}默默{/hl}地坐在角落里。",
      "py": "tā mò mò de zuò zài jiǎoluò lǐ.",
      "ru": "Он молча сидел в углу.",
      "note": "角落 (jiǎoluò) — угол"
    },
    {
      "cn": "她{hl}默默{/hl}地哭了很久。",
      "py": "tā mò mò de kū le hěn jiǔ.",
      "ru": "Она долго плакала в тишине."
    },
    {
      "cn": "父亲{hl}默默{/hl}地为家人付出。",
      "py": "fùqīn mò mò de wèi jiārén fùchū.",
      "ru": "Отец молча отдавал всё ради семьи.",
      "note": "付出 (fùchū) — отдавать, жертвовать"
    },
    {
      "cn": "他{hl}默默{/hl}无闻地工作了很多年。",
      "py": "tā mò mò wú wén de gōngzuò le hěn duō nián.",
      "ru": "Он годами работал незаметно, в безвестности.",
      "note": "默默无闻 — молча и безызвестно"
    }
  ],
  "footer_note": "默默无闻 (mò mò wú wén) — трудиться в тишине и безызвестности · HSK 6 (hsk2.0-L6)"
}
