{
  "hanzi": "损坏",
  "pinyin": "sǔn huài",
  "meaning_ru": "повредить, испортить; повреждение, ущерб",
  "meaning_en": "to damage; to break; damage (noun/verb)",
  "characters": [
    {
      "hz": "损",
      "py": "sǔn",
      "gloss": "убывать, нести потерю, ущерб",
      "role": "потеря"
    },
    {
      "hz": "坏",
      "py": "huài",
      "gloss": "плохой, сломанный, испорченный",
      "role": "результат"
    }
  ],
  "radicals": [
    {
      "hz": "扌",
      "name": "shǒu — рука",
      "note": "Левая часть 损 — рука, совершающая действие. Рука нанесла удар — вещь повреждена"
    }
  ],
  "deep_dive": "<p>损坏 — нейтральный технический глагол: что-то было целым и теперь <strong>повреждено или сломано</strong>. Используется в страховых актах, технических отчётах, жалобах на качество товара.</p><p>Разница с похожими словами: 破坏 (pòhuài) несёт оттенок умышленного разрушения (или «разрушения» системы/мира); 弄坏 (nòng huài) — разговорное «сломать случайно»; а 损坏 — формальное, нейтральное слово без коннотации умысла.</p><p>В быту чаще скажут просто <strong>坏了</strong> — «сломалось». 损坏 звучит официально: в договорах, претензиях, технических документах.</p>",
  "situations": [
    {
      "title": "✦ Заявление в сервис",
      "setup": "Приносишь телефон в ремонт и описываешь проблему.",
      "line": "屏幕损坏了，需要更换。 — «Экран повреждён, нужна замена.»"
    },
    {
      "title": "☁ После аварии",
      "setup": "Описываешь состояние автомобиля после ДТП.",
      "line": "车辆严重损坏，无法行驶。 — «Автомобиль серьёзно повреждён, не может двигаться.»"
    }
  ],
  "examples": [
    {
      "cn": "包裹在运输中{hl}损坏{/hl}了。",
      "py": "bāoguǒ zài yùnshū zhōng sǔn huài le.",
      "ru": "Посылка повредилась при перевозке.",
      "note": "包裹 (bāoguǒ) — посылка · 运输 (yùnshū) — транспортировка"
    },
    {
      "cn": "这件家具{hl}损坏{/hl}了，我要退货。",
      "py": "zhè jiàn jiājù sǔn huài le, wǒ yào tuì huò.",
      "ru": "Эта мебель повреждена, хочу вернуть товар.",
      "note": "退货 (tuì huò) — вернуть товар"
    },
    {
      "cn": "请不要{hl}损坏{/hl}公共设施。",
      "py": "qǐng bù yào sǔn huài gōnggòng shèshī.",
      "ru": "Просьба не повреждать общественное имущество.",
      "note": "公共设施 (gōnggòng shèshī) — общественная инфраструктура"
    }
  ],
  "footer_note": "损坏 — официальный термин для ущерба; в быту чаще 坏了 или 弄坏了 · HSK 6 (hsk2.0-L6)"
}