{
 "hanzi": "小心翼翼",
 "pinyin": "xiǎo xīn yì yì",
 "meaning_ru": "очень осторожно; с величайшей осмотрительностью; затаив дыхание",
 "meaning_en": "with great care; gingerly; ever so cautiously",
 "characters": [
  {
   "hz": "小心",
   "py": "xiǎo xīn",
   "gloss": "осторожно",
   "role": "основа — «маленькое сердце»"
  },
  {
   "hz": "翼翼",
   "py": "yì yì",
   "gloss": "крылья-крылья",
   "role": "удвоение — усиливает до предела"
  }
 ],
 "radicals": [
  {
   "hz": "羽",
   "name": "yǔ — перья",
   "note": "Верх иероглифа 翼 — два пёрышка 羽. Внизу 異 (отличие). Птица складывает крылья и замирает — отсюда образ предельной осторожности"
  }
 ],
 "deep_dive": "<p>Буквально <strong>«маленькое сердце, крылья-крылья»</strong>. 小心 — это и так «осторожно» (дословно «уменьшить сердце»), а удвоенное 翼翼 доводит до максимума: будто птица прижала крылья и боится шелохнуться.</p><p>Это книжный, чуть торжественный оборот — сильнее простого 小心. Так двигаются, когда несут полную чашку до краёв, ступают по тонкому льду или подбирают слова в трудном разговоре. Чувствуется напряжённое внимание к каждому движению.</p>",
 "situations": [
  {
   "title": "✦ Хрупкое в руках",
   "setup": "Несёшь что-то, что легко разбить.",
   "line": "他小心翼翼地把杯子放下。 — «Он осторожно, бережно поставил чашку.»"
  },
  {
   "title": "☁ Деликатный разговор",
   "setup": "Подбираешь слова, чтобы не задеть.",
   "line": "我小心翼翼地问了她。 — «Я очень осторожно её спросил.»"
  }
 ],
 "examples": [
  {
   "cn": "他{hl}小心翼翼{/hl}地走过去。",
   "py": "tā xiǎoxīnyìyì de zǒu guòqù.",
   "ru": "Он осторожно, шаг за шагом подошёл.",
   "note": "走过去 — подойти"
  },
  {
   "cn": "她{hl}小心翼翼{/hl}地打开了盒子。",
   "py": "tā xiǎoxīnyìyì de dǎkāi le hézi.",
   "ru": "Она осторожно открыла коробку.",
   "note": "打开 (dǎkāi) — открыть · 盒子 (hézi) — коробка"
  },
  {
   "cn": "做这件事要{hl}小心翼翼{/hl}。",
   "py": "zuò zhè jiàn shì yào xiǎoxīnyìyì.",
   "ru": "Это дело надо делать крайне осторожно.",
   "note": "件 (jiàn) — счётное слово для дел"
  }
 ],
 "footer_note": "小心翼翼 — 翼 это «крыло»; удвоение усиливает образ · HSK 6 (hsk2.0-L6)"
}
