{
  "hanzi": "启程",
  "pinyin": "qǐ chéng",
  "meaning_ru": "отправиться в путь, выехать (начало поездки)",
  "meaning_en": "to set out; to depart on a journey",
  "characters": [
    {
      "hz": "启",
      "py": "qǐ",
      "gloss": "открывать, начинать",
      "role": "начало, первый шаг"
    },
    {
      "hz": "程",
      "py": "chéng",
      "gloss": "путь, дорога, маршрут",
      "role": "путешествие"
    }
  ],
  "deep_dive": "<p>启程 — <strong>торжественное и немного поэтичное</strong> слово для начала пути. Не просто «ехать», а именно момент отправления — когда переступаешь порог и начинается дорога.</p><p>В бытовой речи чаще скажут 出发 (chūfā) — оно нейтральнее и короче. 启程 звучит в романах, в новостях («делегация 启程前往北京»), в прощальных словах. В нём есть ощущение важности момента — как поднятие якоря.</p>",
  "situations": [
    {
      "title": "✦ Прощание",
      "setup": "Провожаешь друга, который уезжает надолго.",
      "line": "他明天就要启程了。 — «Он завтра отправляется в путь.»"
    },
    {
      "title": "☁ Начало чего-то нового",
      "setup": "Метафорически — о начале нового этапа.",
      "line": "人生的新旅程就此启程。 — «Новое путешествие в жизни начинается с этого момента.»"
    }
  ],
  "examples": [
    {
      "cn": "我们明天早上{hl}启程{/hl}。",
      "py": "wǒmen míngtiān zǎoshang qǐ chéng.",
      "ru": "Мы отправляемся в путь завтра утром."
    },
    {
      "cn": "代表团已经{hl}启程{/hl}前往北京。",
      "py": "dàibiǎotuán yǐjīng qǐ chéng qiánwǎng běijīng.",
      "ru": "Делегация уже выехала в Пекин.",
      "note": "代表团 (dàibiǎotuán) — делегация"
    },
    {
      "cn": "是时候{hl}启程{/hl}了。",
      "py": "shì shíhòu qǐ chéng le.",
      "ru": "Пришло время отправляться.",
      "note": "是时候 (shì shíhòu) — пора, время пришло"
    }
  ],
  "footer_note": "启程 — торжественное; в разговоре чаще 出发 (chūfā) · HSK 6 (hsk2.0-L6)"
}