{
 "hanzi": "变为",
 "pinyin": "biàn wéi",
 "meaning_ru": "превратиться в, стать (чем-то)",
 "meaning_en": "to change into, turn into, become",
 "characters": [
  {
   "hz": "变",
   "py": "biàn",
   "gloss": "меняться, превращаться",
   "role": "процесс изменения"
  },
  {
   "hz": "为",
   "py": "wéi",
   "gloss": "быть, становиться кем/чем",
   "role": "указывает результат"
  }
 ],
 "deep_dive": "<p>变 — «меняться, превращаться», а 为 здесь читается <strong>wéi</strong> и значит «становиться, быть». Вместе — «измениться и стать чем-то». Связка указывает на <strong>результат</strong> превращения: A 变为 B = «A превратилось в B».</p><p>Слово книжное, чуть письменное. В живой речи чаще скажут 变成 (biànchéng) — то же значение, но теплее и разговорнее. 变为 любят тексты, отчёты, новости: «вода 变为 пар».</p>",
 "situations": [
  {
   "title": "✦ Превращение",
   "setup": "Описываешь изменение в природе.",
   "line": "水变为冰。 — «Вода превращается в лёд.»"
  }
 ],
 "examples": [
  {
   "cn": "小村子{hl}变为{/hl}了大城市。",
   "py": "Xiǎo cūnzi biànwéi le dà chéngshì.",
   "ru": "Маленькая деревня превратилась в большой город.",
   "note": "村子 (cūnzi) — деревня · 城市 (chéngshì) — город"
  },
  {
   "cn": "他的梦想{hl}变为{/hl}了现实。",
   "py": "Tā de mèngxiǎng biànwéi le xiànshí.",
   "ru": "Его мечта стала реальностью.",
   "note": "梦想 (mèngxiǎng) — мечта · 现实 (xiànshí) — реальность"
  },
  {
   "cn": "天气{hl}变为{/hl}晴天了。",
   "py": "Tiānqì biànwéi qíngtiān le.",
   "ru": "Погода стала ясной.",
   "note": "晴天 (qíngtiān) — ясная погода"
  }
 ],
 "footer_note": "变为 — книжное; в речи чаще 变成 (biànchéng) · HSK 3 (hsk3.0-L3)"
}
