{
  "hanzi": "杂志",
  "pinyin": "zázhì",
  "meaning_ru": "журнал",
  "meaning_en": "magazine",
  "characters": [
    { "hz": "杂", "py": "zá", "gloss": "разное, смешанное", "role": "характеристика содержания" },
    { "hz": "志", "py": "zhì", "gloss": "записи, воля", "role": "форма издания" }
  ],
  "radicals": [
    { "hz": "木", "name": "mù — дерево", "note": "Нижняя часть 杂. Деревяшки и обрезки — образ «всякой всячины»" },
    { "hz": "心", "name": "xīn — сердце", "note": "Нижняя часть 志. Воля, стремление — то, что в сердце. Здесь 志 в значении «записи»" }
  ],
  "deep_dive": "<p>Буквально — <strong>«записи о разном»</strong>. 杂 — смешанный, разнообразный, 志 — записи, летопись. Журнал — это и есть сборник разных материалов.</p><p>Пара к 报纸 (газета): газета — на бумаге, о новостях; журнал — о разном, с картинками. В жизни: 看杂志 — листать журнал.</p>",
  "situations": [
    { "title": "✦ В магазине", "setup": "Ищешь что-то почитать.", "line": "这里有杂志吗？ — «Тут есть журналы?»" }
  ],
  "examples": [
    { "cn": "我喜欢看{hl}杂志{/hl}。", "py": "Wǒ xǐhuan kàn zázhì.", "ru": "Я люблю читать журналы." },
    { "cn": "这本{hl}杂志{/hl}是新的。", "py": "Zhè běn zázhì shì xīn de.", "ru": "Этот журнал новый.", "note": "本 (běn) — счётное слово для книг и журналов" },
    { "cn": "你要买{hl}杂志{/hl}还是报纸？", "py": "Nǐ yào mǎi zázhì háishi bàozhǐ?", "ru": "Ты хочешь купить журнал или газету?", "note": "还是 (háishi) — или (в вопросе)" }
  ],
  "footer_note": "杂志 — печатное издание, пара к 报纸 · HSK 3"
}
