{
  "hanzi": "处理",
  "pinyin": "chǔ lǐ",
  "meaning_ru": "разбираться (с чем-то), улаживать; обрабатывать; наказывать; продавать по сниженной цене",
  "meaning_en": "to handle; to deal with; to process; to sell at a discount",
  "characters": [
    {
      "hz": "处",
      "py": "chǔ",
      "gloss": "находиться в (какой-то ситуации); поступать",
      "role": "действие по отношению к ситуации"
    },
    {
      "hz": "理",
      "py": "lǐ",
      "gloss": "порядок, логика, управлять",
      "role": "привести в порядок, разобраться"
    }
  ],
  "deep_dive": "<p><strong>处理</strong> — нейтральное, деловое слово. «Разобраться с задачей», «уладить вопрос», «обработать данные» — всё это 处理. В корпоративном мире это слово мелькает постоянно: «я это обработаю», «передай это в отдел».</p><p>Интересно, что 处理 может означать и <strong>снизить цену, распродать</strong>: 处理品 — уценённый товар. Увидел в магазине табличку 处理 — там скидки, а не отдел по работе с жалобами.</p><p>Разница с 解决 (jiějué): 解决 — <strong>решить</strong> (найти окончательное решение), 处理 — <strong>разобраться</strong> (заняться, предпринять шаги). Проблему можно 处理, но не обязательно 解决.</p>",
  "situations": [
    {
      "title": "✦ Рабочий вопрос",
      "setup": "Коллега просит взяться за дело.",
      "line": "这件事你来处理吧。 — «Это дело — твоя задача.»"
    },
    {
      "title": "☁ Срочно",
      "setup": "Нужно разобраться с возникшей проблемой.",
      "line": "我现在去处理这个问题。 — «Я сейчас займусь этим вопросом.»"
    }
  ],
  "examples": [
    {
      "cn": "你能帮我{hl}处理{/hl}这件事吗？",
      "py": "Nǐ néng bāng wǒ chǔlǐ zhè jiàn shì ma?",
      "ru": "Ты можешь помочь мне разобраться с этим делом?"
    },
    {
      "cn": "这些文件我已经{hl}处理{/hl}好了。",
      "py": "Zhèxiē wénjiàn wǒ yǐjīng chǔlǐ hǎo le.",
      "ru": "Я уже разобрался с этими документами.",
      "note": "文件 (wénjiàn) — документы · 已经 — уже"
    },
    {
      "cn": "超市里有{hl}处理{/hl}品，很便宜。",
      "py": "Chāoshì lǐ yǒu chǔlǐ pǐn, hěn piányí.",
      "ru": "В супермаркете есть уценённые товары, очень дёшево.",
      "note": "处理品 — уценённый товар · 便宜 (piányí) — дёшево"
    },
    {
      "cn": "这个问题很难{hl}处理{/hl}。",
      "py": "Zhège wèntí hěn nán chǔlǐ.",
      "ru": "С этим вопросом трудно разобраться."
    }
  ],
  "footer_note": "处理品 — уценённый товар · 处理 vs 解决: разобраться vs решить · HSK 5 (hsk2.0-L5)"
}