{
  "hanzi": "二氧化碳",
  "pinyin": "èr yǎng huà tàn",
  "meaning_ru": "углекислый газ, диоксид углерода (CO₂)",
  "meaning_en": "carbon dioxide (CO₂)",
  "characters": [
    {
      "hz": "二",
      "py": "èr",
      "gloss": "два",
      "role": "количество атомов"
    },
    {
      "hz": "氧",
      "py": "yǎng",
      "gloss": "кислород",
      "role": "элемент"
    },
    {
      "hz": "化",
      "py": "huà",
      "gloss": "-ид, соединять",
      "role": "связка соединения"
    },
    {
      "hz": "碳",
      "py": "tàn",
      "gloss": "углерод",
      "role": "элемент"
    }
  ],
  "radicals": [
    {
      "hz": "气",
      "name": "qì — газ, воздух",
      "note": "Верх и обрамление 氧. Этот ключ — «пар, поднимающийся над едой» — стоит у всех газов: 氧 (кислород), 氢 (qīng — водород), 氮 (dàn — азот). Видишь 气 сверху — речь о чём-то газообразном"
    },
    {
      "hz": "石",
      "name": "shí — камень",
      "note": "Левая часть 碳. Углерод — это уголь и графит, твёрдая чёрная порода, поэтому к нему прилепили «камень». Справа 炭 (tàn) — древесный уголь, который и даёт звук, и подсказывает смысл"
    }
  ],
  "deep_dive": "<p>Это слово читается как маленькая химическая формула. Разбери по кускам: <strong>二</strong> (два) + <strong>氧</strong> (кислород) + <strong>化</strong> (соединение) + <strong>碳</strong> (углерод) — буквально «дву-кислородное соединение углерода». Это и есть CO₂: один атом углерода, два — кислорода.</p><p>Самое красивое здесь — что китайский собирает названия веществ как конструктор. <strong>化</strong> (huà, «превращать, соединять») — та самая частица, что превращает два элемента в соединение: 氧化 — «окислять», а 二氧化 — «диоксид». Поменяй число впереди — и получишь соседа: <strong>一氧化碳</strong> (yī yǎng huà tàn) — угарный газ, тот самый ядовитый CO с одним кислородом. Разница между «жить» и «задохнуться» — в одном иероглифе 一 / 二.</p><p>Тот же 化 ты уже встречал в 化学 (huàxué) — «химия», дословно «наука о превращениях». Зная его, ты читаешь половину таблицы Менделеева по-китайски.</p>",
  "situations": [
    {
      "title": "✦ На уроке",
      "setup": "Учитель объясняет, чем дышат растения.",
      "line": "植物吸收二氧化碳。 — «Растения поглощают углекислый газ.»"
    },
    {
      "title": "☁ Про экологию",
      "setup": "Говорите о потеплении и выбросах.",
      "line": "二氧化碳太多了。 — «Углекислого газа слишком много.»"
    }
  ],
  "examples": [
    {
      "cn": "树吸收{hl}二氧化碳{/hl}。",
      "py": "shù xīshōu èr yǎng huà tàn.",
      "ru": "Деревья поглощают углекислый газ.",
      "note": "树 (shù) — дерево · 吸收 (xīshōu) — поглощать"
    },
    {
      "cn": "我们呼出{hl}二氧化碳{/hl}。",
      "py": "wǒmen hūchū èr yǎng huà tàn.",
      "ru": "Мы выдыхаем углекислый газ.",
      "note": "呼出 (hūchū) — выдыхать"
    },
    {
      "cn": "汽车产生很多{hl}二氧化碳{/hl}。",
      "py": "qìchē chǎnshēng hěn duō èr yǎng huà tàn.",
      "ru": "Машины производят много углекислого газа.",
      "note": "汽车 (qìchē) — машина · 产生 (chǎnshēng) — производить"
    },
    {
      "cn": "{hl}二氧化碳{/hl}对环境不好。",
      "py": "èr yǎng huà tàn duì huánjìng bù hǎo.",
      "ru": "Углекислый газ вреден для окружающей среды.",
      "note": "对…不好 — вреден для · 环境 (huánjìng) — окружающая среда"
    }
  ],
  "footer_note": "二氧化碳 — читается как формула CO₂; сосед 一氧化碳 — угарный газ (CO) · HSK 6"
}