{
  "hanzi": "出神",
  "pinyin": "chū shén",
  "meaning_ru": "уйти в себя, задуматься, потерять нить настоящего; быть как заворожённым",
  "meaning_en": "to be lost in thought, entranced, spellbound; to zone out",
  "characters": [
    {
      "hz": "出",
      "py": "chū",
      "gloss": "выходить",
      "role": "«уйти» из настоящего"
    },
    {
      "hz": "神",
      "py": "shén",
      "gloss": "дух, сознание",
      "role": "то, что «ушло»"
    }
  ],
  "deep_dive": "<p>出神 — это когда <strong>твой дух (神) вышел (出) из тела</strong>, а сам ты остался сидеть с пустым взглядом. Образ очень китайский: разум как нечто, способное «уйти» куда-то, пока тело стоит на месте.</p><p>У слова два оттенка. Первый — <strong>задуматься, уйти в мысли</strong>: сидишь и смотришь в никуда, не слышишь, что тебе говорят. Второй — <strong>быть заворожённым</strong>: смотришь на что-то красивое и не можешь оторваться. Оба — про то, что что-то захватило тебя целиком.</p><p>По форме 出神 — глагол-предикат: <strong>她看得出神了</strong> — «она смотрела, заворожённая». Или отдельно: <strong>他发呆出神</strong> — «он сидел, уставившись в никуда».</p>",
  "situations": [
    {
      "title": "✦ Задумался",
      "setup": "Друг не реагирует на зов — мысли где-то далеко.",
      "line": "他看着窗外，出神了。 — «Он смотрел в окно, уйдя в себя.»"
    },
    {
      "title": "☁ Завороженность",
      "setup": "Кто-то так увлёкся музыкой, что перестал замечать мир.",
      "line": "她听着音乐，听得出神了。 — «Она слушала музыку — так, что ушла в неё с головой.»"
    }
  ],
  "examples": [
    {
      "cn": "他坐在那里{hl}出神{/hl}，没有听到我说话。",
      "py": "Tā zuò zài nàlǐ chū shén, méiyǒu tīng dào wǒ shuōhuà.",
      "ru": "Он сидел, погружённый в мысли, и не услышал меня."
    },
    {
      "cn": "她看着那幅画，看得{hl}出神{/hl}了。",
      "py": "Tā kàn zhe nà fú huà, kàn de chū shén le.",
      "ru": "Она смотрела на эту картину, как заворожённая.",
      "note": "幅 (fú) — счётное слово для картин · 画 (huà) — картина"
    },
    {
      "cn": "我{hl}出神{/hl}地想着那件事。",
      "py": "Wǒ chū shén de xiǎng zhe nà jiàn shì.",
      "ru": "Я думал об этом деле, уйдя в себя."
    }
  ],
  "footer_note": "出神 — дух «вышел»: и задуматься, и быть заворожённым · HSK 6 (hsk2.0-L6)"
}
