{
  "hanzi": "振兴",
  "pinyin": "zhèn xīng",
  "meaning_ru": "возродить, оживить, поднять (экономику, страну, отрасль)",
  "meaning_en": "to revitalize; to rejuvenate; to reinvigorate",
  "characters": [
    {
      "hz": "振",
      "py": "zhèn",
      "gloss": "встряхнуть, поднять",
      "role": "действие"
    },
    {
      "hz": "兴",
      "py": "xīng",
      "gloss": "процветать, подниматься",
      "role": "результат"
    }
  ],
  "deep_dive": "<p>振兴 — слово из официального, публичного языка. Это не просто «улучшить» — это <strong>поднять с колен</strong>, вернуть утраченное величие. Сельское хозяйство, экономика депрессивных регионов, национальная культура — вот где живёт 振兴.</p><p>振 буквально — «встряхнуть», как отряхиваются после падения. 兴 — «расцветать, подниматься». Вместе: встряхнули — и пошло в гору. Это слово несёт в себе разворот после упадка.</p><p>В китайских СМИ и политических речах 振兴 встречается постоянно — «振兴中华» (возрождение Китая) стало почти лозунгом. Обычный бытовой глагол тут был бы слишком мелким.</p>",
  "situations": [
    {
      "title": "✦ В новостях",
      "setup": "Читаешь статью о государственной программе.",
      "line": "政府努力振兴农村经济。 — «Правительство усиленно возрождает сельскую экономику.»"
    },
    {
      "title": "☁ Личный масштаб",
      "setup": "Кто-то говорит о возрождении старого дела или традиции.",
      "line": "他想振兴家族企业。 — «Он хочет возродить семейный бизнес.»"
    }
  ],
  "examples": [
    {
      "cn": "政府计划{hl}振兴{/hl}这个地区的经济。",
      "py": "zhèngfǔ jìhuà zhèn xīng zhège dìqū de jīngjì.",
      "ru": "Правительство планирует возродить экономику этого региона.",
      "note": "计划 (jìhuà) — планировать · 地区 (dìqū) — регион"
    },
    {
      "cn": "他决心{hl}振兴{/hl}传统文化。",
      "py": "tā juéxīn zhèn xīng chuántǒng wénhuà.",
      "ru": "Он полон решимости возродить традиционную культуру.",
      "note": "决心 (juéxīn) — быть полным решимости"
    },
    {
      "cn": "{hl}振兴{/hl}中华是我们的目标。",
      "py": "zhèn xīng zhōnghuá shì wǒmen de mùbiāo.",
      "ru": "Возрождение Китая — наша цель.",
      "note": "目标 (mùbiāo) — цель"
    }
  ],
  "footer_note": "振兴 — официальный регистр, типично о масштабном возрождении · HSK 6 (hsk2.0-L6)"
}