{
 "hanzi": "拦",
 "pinyin": "lán",
 "meaning_ru": "преграждать путь, останавливать; задержать; поймать (такси)",
 "meaning_en": "to block (sb's way); to stop; to hold back; to flag down (a taxi)",
 "radicals": [
  {
   "hz": "扌",
   "name": "shǒu — рука",
   "note": "Левая часть 拦. Сжатый ключ «рука» (от 手). Преградить путь — это движение рукой: вытянул руку — остановил. Справа 兰 даёт звук «lán»"
  }
 ],
 "deep_dive": "<p>拦 — это <strong>встать на пути и не пустить</strong>. Рука (扌 слева) вытягивается и преграждает дорогу. «别拦我！» — «не держи меня, не мешай мне пройти».</p><p>Очень живое уличное слово: <strong>拦车</strong> — поймать машину, тормознуть такси, голосуя рукой на обочине. Можно 拦 человека (перехватить, остановить), 拦 мяч (в спорте отбить, перехватить). Везде один жест — рука поперёк движения.</p>",
 "situations": [
  {
   "title": "✦ На улице",
   "setup": "Ловишь такси, подняв руку.",
   "line": "我拦了一辆出租车。 — «Я поймал такси.»"
  },
  {
   "title": "☁ Не мешай",
   "setup": "Кто-то пытается тебя удержать.",
   "line": "你别拦我！ — «Не держи меня!»"
  }
 ],
 "examples": [
  {
   "cn": "他在门口{hl}拦{/hl}住了我。",
   "py": "tā zài ménkǒu lánzhù le wǒ.",
   "ru": "Он остановил меня у двери.",
   "note": "拦住 — задержать, остановить · 门口 — у входа"
  },
  {
   "cn": "我们在路边{hl}拦{/hl}车。",
   "py": "wǒmen zài lùbiān lán chē.",
   "ru": "Мы ловим машину на обочине.",
   "note": "拦车 — ловить такси · 路边 — обочина"
  },
  {
   "cn": "你别{hl}拦{/hl}我。",
   "py": "nǐ bié lán wǒ.",
   "ru": "Не останавливай меня.",
   "note": "别 (bié) — не надо"
  }
 ],
 "footer_note": "拦 — рука (扌) поперёк пути; 拦车 — ловить такси, 拦住 — задержать · HSK 5 (hsk2.0-L5)"
}
