{
 "hanzi": "夏令营",
 "pinyin": "xià lìng yíng",
 "meaning_ru": "летний лагерь (детский)",
 "meaning_en": "summer camp",
 "characters": [
  {
   "hz": "夏",
   "py": "xià",
   "gloss": "лето",
   "role": "сезон"
  },
  {
   "hz": "令",
   "py": "lìng",
   "gloss": "сезон, пора",
   "role": "временной отрезок"
  },
  {
   "hz": "营",
   "py": "yíng",
   "gloss": "лагерь",
   "role": "место сбора"
  }
 ],
 "deep_dive": "<p>Складывается из трёх частей: <strong>夏</strong> — лето, <strong>令</strong> — здесь «пора, сезон» (как в 时令, «время года»), <strong>营</strong> — лагерь, стоянка. Вместе — «летне-сезонный лагерь».</p><p>Тот же 营 — это «военный лагерь, бивак», отсюда привкус организованного сбора с распорядком. По той же модели строятся 冬令营 (dōnglìngyíng) — зимний лагерь. Слово современное, про детские каникулы: спорт, английский, природа.</p>",
 "situations": [
  {
   "title": "☁ Летние планы",
   "setup": "Рассказываешь, куда едет ребёнок.",
   "line": "我儿子今年去夏令营。 — «Мой сын этим летом едет в лагерь.»"
  }
 ],
 "examples": [
  {
   "cn": "孩子们都喜欢{hl}夏令营{/hl}。",
   "py": "háizimen dōu xǐhuan xiàlìngyíng.",
   "ru": "Дети все любят летний лагерь.",
   "note": "孩子们 — дети"
  },
  {
   "cn": "今年夏天我去了英语{hl}夏令营{/hl}。",
   "py": "jīnnián xiàtiān wǒ qùle yīngyǔ xiàlìngyíng.",
   "ru": "Этим летом я ездил в английский лагерь.",
   "note": "英语 — английский язык"
  },
  {
   "cn": "{hl}夏令营{/hl}有很多活动。",
   "py": "xiàlìngyíng yǒu hěn duō huódòng.",
   "ru": "В летнем лагере много занятий.",
   "note": "活动 (huódòng) — мероприятие"
  }
 ],
 "footer_note": "夏令营 — 令 здесь «сезон»; зимний аналог — 冬令营 · HSK 6 (hsk2.0-L6)"
}
