{
  "hanzi": "当年",
  "pinyin": "dāng nián",
  "meaning_ru": "в те годы, в то время; тогда; тот же самый год",
  "meaning_en": "back then, in those days; that very year (also: in one's prime)",
  "characters": [
    {
      "hz": "当",
      "py": "dāng",
      "gloss": "в тот момент, как раз",
      "role": "указание на время"
    },
    {
      "hz": "年",
      "py": "nián",
      "gloss": "год",
      "role": "единица времени"
    }
  ],
  "deep_dive": "<p><strong>当年</strong> — «в те годы», отсылка в прошлое. Это слово ностальгии и воспоминаний. «当年我们都很年轻» — «тогда мы были молоды». Не конкретный год, а целая эпоха — та, другая жизнь.</p><p>Но у 当年 есть и точное значение: <strong>тот же самый год</strong> — в документах и статистике 当年 означает «в этом же году, в том же году». Контекст разводит эти два смысла: ностальгия vs. деловой оборот.</p><p>Ещё одно значение — <strong>расцвет, лучшие годы</strong>: 当年他是冠军 — «в свои лучшие годы он был чемпионом». Три смысла, один иероглиф — слушай интонацию.</p>",
  "situations": [
    {
      "title": "✦ Воспоминания",
      "setup": "Старые друзья вспоминают молодость.",
      "line": "当年我们一起上学，真是开心。 — «В те годы мы вместе ходили в школу — как было хорошо.»"
    }
  ],
  "examples": [
    {
      "cn": "{hl}当年{/hl}这里是一片森林。",
      "py": "Dāngnián zhèlǐ shì yī piàn sēnlín.",
      "ru": "В то время здесь был лес.",
      "note": "一片 (yī piàn) — массив, площадь · 森林 (sēnlín) — лес"
    },
    {
      "cn": "他{hl}当年{/hl}很帅。",
      "py": "Tā dāngnián hěn shuài.",
      "ru": "В молодости он был очень красивым."
    },
    {
      "cn": "项目{hl}当年{/hl}就完成了。",
      "py": "Xiàngmù dāngnián jiù wánchéng le.",
      "ru": "Проект был завершён в тот же год.",
      "note": "项目 (xiàngmù) — проект · 完成 (wánchéng) — завершить"
    }
  ],
  "footer_note": "当年 — «в те годы» (ностальгия) или «в тот же год» (деловой язык) · freq #1469"
}
