{
 "hanzi": "机智",
 "pinyin": "jī zhì",
 "meaning_ru": "находчивый, смекалистый; сообразительность, остроумие",
 "meaning_en": "quick-witted, resourceful; sharp presence of mind",
 "characters": [
  {
   "hz": "机",
   "py": "jī",
   "gloss": "момент, повод; гибкость",
   "role": "чутьё на момент"
  },
  {
   "hz": "智",
   "py": "zhì",
   "gloss": "ум, мудрость",
   "role": "смысловая основа"
  }
 ],
 "radicals": [
  {
   "hz": "日",
   "name": "rì — солнце",
   "note": "Низ иероглифа 智. Над ним 知 (знать). Образ: знание, ясное как день — отсюда «ум, мудрость». Чтобы запомнить, представь: умная голова светла, как солнце"
  }
 ],
 "deep_dive": "<p>机智 — это ум не книжный, а <strong>быстрый</strong>. Не «много знает», а «мгновенно соображает, как выкрутиться». Находчивость в моменте, когда нужно среагировать прямо сейчас.</p><p>Ключ — в 机: это «удобный момент, поворотная точка». 机智 буквально «ум, заточенный на момент». Герой, который в ловушке придумывает хитрый ход — вот он 机智.</p><p>Слово тёплое и одобрительное. 机智的回答 — «остроумный ответ». В интернете молодёжь шутливо хвалит себя: 机智如我 — «вот я молодец, ловко придумал».</p>",
 "situations": [
  {
   "title": "✦ Похвала",
   "setup": "Восхищаешься чьей-то сообразительностью.",
   "line": "你太机智了！ — «Ну ты и молодец, ловко!»"
  },
  {
   "title": "✧ Про героя",
   "setup": "Описываешь находчивого персонажа.",
   "line": "他是个机智的孩子。 — «Он смышлёный мальчишка.»"
  }
 ],
 "examples": [
  {
   "cn": "你太{hl}机智{/hl}了！",
   "py": "nǐ tài jīzhì le!",
   "ru": "Ну ты и находчивый!",
   "note": "太...了 — слишком, очень"
  },
  {
   "cn": "他是个{hl}机智{/hl}的人。",
   "py": "tā shì ge jīzhì de rén.",
   "ru": "Он сообразительный человек."
  },
  {
   "cn": "她{hl}机智{/hl}地回答了问题。",
   "py": "tā jīzhì de huídá le wèntí.",
   "ru": "Она остроумно ответила на вопрос.",
   "note": "回答 (huídá) — отвечать"
  }
 ],
 "footer_note": "机智 — быстрый ум в моменте (не книжность) · в сети: 机智如我 «вот я ловкач» · HSK 6 (hsk2.0-L6)"
}
