{
  "hanzi": "不客气",
  "pinyin": "bú kèqi",
  "meaning_ru": "не за что, пожалуйста",
  "meaning_en": "you're welcome",
  "characters": [
    { "hz": "不", "py": "bù", "gloss": "не", "role": "отрицание" },
    { "hz": "客", "py": "kè", "gloss": "гость", "role": "смысловая основа" },
    { "hz": "气", "py": "qi", "gloss": "энергия, дух", "role": "абстрактная часть" }
  ],
  "deep_dive": "<p>不 (не) + 客气 (kèqi, вежливый, церемонный) = <strong>«не церемонься»</strong>. Стандартный ответ на 谢谢. Логика: ты благодаришь — я говорю «не будь таким формальным, мы же свои».</p><p>客气 буквально: «гостевая энергия» — вести себя как вежливый гость, быть церемонным. 不客气 снимает эту дистанцию.</p>",
  "situations": [
    { "title": "✦ Ответ на благодарность", "setup": "Тебе говорят спасибо.", "line": "不客气！ — «Не за что!»" }
  ],
  "examples": [
    { "cn": "——谢谢。——{hl}不客气{/hl}。", "py": "—— xièxie. —— bú kèqi.", "ru": "— Спасибо. — Не за что." },
    { "cn": "{hl}不客气{/hl}，这是我应该做的。", "py": "bú kèqi, zhè shì wǒ yīnggāi zuò de.", "ru": "Не за что, это моя обязанность.", "note": "应该 (yīnggāi) — должен" },
    { "cn": "别{hl}客气{/hl}。", "py": "bié kèqi.", "ru": "Не стесняйся." }
  ],
  "footer_note": "不客气 — ответ на 谢谢 · 别客气 = не стесняйся · HSK 1"
}
