{
 "hanzi": "监视",
 "pinyin": "jiān shì",
 "meaning_ru": "следить, вести наблюдение (тайно, за подозреваемым); слежка, надзор",
 "meaning_en": "to monitor, to keep watch over (covertly); surveillance",
 "characters": [
  {
   "hz": "监",
   "py": "jiān",
   "gloss": "надзирать, наблюдать",
   "role": "присмотр"
  },
  {
   "hz": "视",
   "py": "shì",
   "gloss": "смотреть, обозревать",
   "role": "взгляд"
  }
 ],
 "radicals": [
  {
   "hz": "礻",
   "name": "shì — даёт звук и взгляд",
   "note": "Левая часть 视. Справа 见 (видеть) несёт смысл, а 礻подсказывает чтение «shì». Само 视 — «направленный взгляд», не случайный, а пристальный"
  }
 ],
 "deep_dive": "<p>监视 — это <strong>пристальное, часто тайное наблюдение</strong>: камера за входом, агент за подозреваемым, враг за позициями. В слове сквозит настороженность, подозрение, контроль над тем, кому не доверяют.</p><p>Сравни с 监督 (jiāndū): тот — открытый, законный надзор за качеством и порядком (его даже «接受», принимают добровольно). А 监视 — глаз, который следит исподтишка. «监视器» — камера наблюдения, «被监视» — «быть под наблюдением» звучит уже тревожно.</p>",
 "situations": [
  {
   "title": "☁ Слежка",
   "setup": "Говоришь о наблюдении за подозреваемым.",
   "line": "警察在监视那个人。 — «Полиция следит за тем человеком.»"
  }
 ],
 "examples": [
  {
   "cn": "他们在{hl}监视{/hl}这座大楼。",
   "py": "tāmen zài jiānshì zhè zuò dàlóu.",
   "ru": "Они наблюдают за этим зданием.",
   "note": "大楼 (dàlóu) — здание · 座 — счётное слово"
  },
  {
   "cn": "商店里有很多{hl}监视{/hl}摄像头。",
   "py": "shāngdiàn lǐ yǒu hěn duō jiānshì shèxiàngtóu.",
   "ru": "В магазине много камер наблюдения.",
   "note": "摄像头 (shèxiàngtóu) — камера"
  },
  {
   "cn": "他感觉自己被{hl}监视{/hl}了。",
   "py": "tā gǎnjué zìjǐ bèi jiānshì le.",
   "ru": "Он почувствовал, что за ним следят.",
   "note": "被 (bèi) — пассив · 感觉 — чувствовать"
  }
 ],
 "footer_note": "监视 — тайная слежка (настороженность); 监督 — открытый, законный надзор · HSK 6 (hsk2.0-L6)"
}
