{
  "hanzi": "私自",
  "pinyin": "sī zì",
  "meaning_ru": "самовольно, без разрешения; тайком, в обход правил",
  "meaning_en": "without authorization; on one's own initiative (in a negative sense); secretly and improperly",
  "characters": [
    {
      "hz": "私",
      "py": "sī",
      "gloss": "личный, частный; тайный",
      "role": "«в частном порядке»"
    },
    {
      "hz": "自",
      "py": "zì",
      "gloss": "сам, самостоятельно",
      "role": "«по собственной инициативе»"
    }
  ],
  "deep_dive": "<p>私自 — это не просто «самостоятельно», а <strong>самовольно, нарушив порядок</strong>. Слово несёт негативную коннотацию: действие сделано без чьего-то ведома или разрешения, когда это требовалось. 私自离开 — «самовольно ушёл» (дезертировал или ушёл без отгула). 私自动用公款 — «самовольно воспользовался казёнными деньгами».</p><p>Сравни с нейтральным <strong>自己</strong> (сам, самостоятельно) — без оттенка нарушения. Или с 擅自 (shànzì) — очень близко к 私自, но чуть официальнее и жёстче по тону. 私自 чаще в разговорной и деловой речи.</p>",
  "situations": [
    {
      "title": "☁ Упрёк",
      "setup": "Ребёнок взял деньги без спроса.",
      "line": "你怎么能私自拿我的钱？ — «Как ты посмел взять мои деньги без разрешения?»"
    },
    {
      "title": "✦ Правила",
      "setup": "На работе нарушили регламент.",
      "line": "不得私自修改文件。 — «Запрещается вносить изменения в документы без разрешения.»"
    }
  ],
  "examples": [
    {
      "cn": "他{hl}私自{/hl}离开了工作岗位。",
      "py": "Tā sīzì líkāi le gōngzuò gǎngwèi.",
      "ru": "Он самовольно покинул рабочее место.",
      "note": "岗位 (gǎngwèi) — пост, рабочее место"
    },
    {
      "cn": "不能{hl}私自{/hl}动用公款。",
      "py": "Bù néng sīzì dòngyòng gōngkuǎn.",
      "ru": "Нельзя самовольно использовать казённые средства.",
      "note": "公款 (gōngkuǎn) — государственные/общественные деньги"
    },
    {
      "cn": "你{hl}私自{/hl}做决定是不对的。",
      "py": "Nǐ sīzì zuò juédìng shì bù duì de.",
      "ru": "Принимать решения самовольно — неправильно.",
      "note": "决定 (juédìng) — решение"
    }
  ],
  "footer_note": "私自 — самовольно, без разрешения (негативная коннота); ср. 擅自 (shànzì) — то же, но официальнее · HSK 6 (hsk2.0-L6)"
}
