{
  "hanzi": "品质",
  "pinyin": "pǐn zhì",
  "meaning_ru": "качество (товара, жизни); душевные качества человека",
  "meaning_en": "quality (of product, life, person); character trait",
  "characters": [
    {
      "hz": "品",
      "py": "pǐn",
      "gloss": "сорт, вид, уровень",
      "role": "оценочная шкала"
    },
    {
      "hz": "质",
      "py": "zhì",
      "gloss": "суть, природа, материал",
      "role": "внутренняя природа"
    }
  ],
  "deep_dive": "<p>品质 — одно из самых гибких слов в китайском. Говорят о <strong>качестве товара</strong> (产品品质 — качество продукта), о <strong>качестве жизни</strong> (生活品质), и о <strong>человеческих качествах</strong> (他有很多好品质 — у него много хороших качеств).</p><p>Разница с похожими словами: 质量 — тоже «качество», но чаще технически (质量标准 — стандарт качества); 品质 — чуть возвышеннее, с оттенком «суть и характер». В рекламе и маркетинге 品质 — любимое слово: подразумевает не просто «хорошо сделано», а <strong>внутреннее достоинство вещи</strong>.</p>",
  "situations": [
    {
      "title": "✦ О покупке",
      "setup": "Выбираешь товар и объясняешь критерии.",
      "line": "我不看价格，只看品质。 — «Я смотрю не на цену, а только на качество.»"
    },
    {
      "title": "☁ О человеке",
      "setup": "Хвалишь чьи-то личные качества.",
      "line": "她有很多好品质，比如耐心和善良。 — «У неё много хороших качеств — терпение и доброта.»"
    }
  ],
  "examples": [
    {
      "cn": "这家店的东西{hl}品质{/hl}很好。",
      "py": "Zhè jiā diàn de dōngxi pǐnzhì hěn hǎo.",
      "ru": "В этом магазине товары очень высокого качества."
    },
    {
      "cn": "提高生活{hl}品质{/hl}是很多人的目标。",
      "py": "Tígāo shēnghuó pǐnzhì shì hěn duō rén de mùbiāo.",
      "ru": "Повысить качество жизни — цель многих людей.",
      "note": "目标 (mùbiāo) — цель"
    },
    {
      "cn": "诚实是一种很重要的{hl}品质{/hl}。",
      "py": "Chéngshí shì yì zhǒng hěn zhòngyào de pǐnzhì.",
      "ru": "Честность — очень важное качество.",
      "note": "诚实 (chéngshí) — честность"
    }
  ],
  "footer_note": "品质 — качество товара, жизни, человека; 质量 — ближе к техническому стандарту · HSK 6 (hsk2.0-L6)"
}