{
 "hanzi": "痛",
 "pinyin": "tòng",
 "meaning_ru": "болеть, боль; горько, мучительно; от души, сполна",
 "meaning_en": "ache, pain; to hurt; deeply, bitterly; thoroughly",
 "radicals": [
  {
   "hz": "疒",
   "name": "nè — болезнь (ключ хвори)",
   "note": "Внешняя «крыша с двумя точками» слева-сверху — ключ всех болезней и боли. Видишь его — речь о хвори: 病 (болезнь), 疼 (болеть). Точки слева как капли пота больного на лежанке"
  }
 ],
 "deep_dive": "<p>痛 — это <strong>боль</strong>, и физическая, и душевная. Голова болит — 头痛 (tóutòng). Сердце ноет от потери — тоже 痛. Ключ болезни 疒 сразу сигналит: тут что-то болит.</p><p>Но у 痛 есть сильное второе лицо — <strong>«до конца, от души, сполна»</strong>. 痛快 (tòngkuài) — буквально «больно-радостно», а значит «легко на душе, в кайф». 痛哭 — рыдать навзрыд. Эмоция, доведённая до предела, по-китайски тоже 痛.</p>",
 "situations": [
  {
   "title": "✦ У врача",
   "setup": "Жалуешься, что болит.",
   "line": "我头很痛。 — «У меня сильно болит голова.»"
  },
  {
   "title": "☁ От всей души",
   "setup": "Описываешь чувство облегчения.",
   "line": "我们玩得很痛快。 — «Мы от души повеселились.»"
  }
 ],
 "examples": [
  {
   "cn": "我的肚子很{hl}痛{/hl}。",
   "py": "Wǒ de dùzi hěn tòng.",
   "ru": "У меня сильно болит живот.",
   "note": "肚子 (dùzi) — живот"
  },
  {
   "cn": "你哪里{hl}痛{/hl}？",
   "py": "Nǐ nǎlǐ tòng?",
   "ru": "Где у тебя болит?",
   "note": "哪里 (nǎlǐ) — где"
  },
  {
   "cn": "今天玩得真{hl}痛{/hl}快。",
   "py": "Jīntiān wán de zhēn tòngkuài.",
   "ru": "Сегодня было так здорово.",
   "note": "痛快 (tòngkuài) — в кайф, от души"
  }
 ],
 "footer_note": "痛 — ключ болезни 疒; 痛快 «больно-радостно» = в кайф · HSK 3 (hsk3.0-L3)"
}
