{
  "hanzi": "策划",
  "pinyin": "cè huà",
  "meaning_ru": "планировать, разрабатывать (проект, акцию); организовывать; также: продюсер, организатор",
  "meaning_en": "to plan, to organize (an event, campaign); also: planner, producer",
  "characters": [
    {
      "hz": "策",
      "py": "cè",
      "gloss": "план, замысел",
      "role": "смысловая основа"
    },
    {
      "hz": "划",
      "py": "huà",
      "gloss": "разрабатывать, намечать",
      "role": "действие"
    }
  ],
  "deep_dive": "<p><strong>策划</strong> — это деятельное планирование: не просто «иметь план», а активно его разрабатывать и воплощать. Часто используется в контексте мероприятий, рекламных кампаний, политических акций.</p><p>Интересно, что слово работает и как глагол, и как существительное: 活动策划 — «организация мероприятий» (как профессия). 婚礼策划师 — «свадебный организатор».</p><p>В нейтральном контексте это просто «организовать», но в новостях 策划 часто появляется рядом со словами «преступление», «теракт» — тогда это ближе к «замышлять», «организовывать (что-то плохое)». Контекст решает.</p>",
  "situations": [
    {
      "title": "✦ В офисе",
      "setup": "Обсуждают подготовку к корпоративному мероприятию.",
      "line": "这次活动由你来策划吧。 — «Пусть организацию этого мероприятия возьмёшь на себя ты.»"
    },
    {
      "title": "☁ В медиа",
      "setup": "Редактор говорит о новом проекте.",
      "line": "这个节目是他策划的。 — «Эту программу он разработал.»"
    }
  ],
  "examples": [
    {
      "cn": "她正在{hl}策划{/hl}一场婚礼。",
      "py": "tā zhèngzài cèhuà yī chǎng hūnlǐ.",
      "ru": "Она сейчас занимается организацией свадьбы.",
      "note": "婚礼 (hūnlǐ) — свадьба"
    },
    {
      "cn": "这次活动{hl}策划{/hl}得很好。",
      "py": "zhè cì huódòng cèhuà de hěn hǎo.",
      "ru": "Это мероприятие было отлично организовано.",
      "note": "活动 (huódòng) — мероприятие"
    },
    {
      "cn": "他们{hl}策划{/hl}了一个新的广告方案。",
      "py": "tāmen cèhuà le yī ge xīn de guǎnggào fāng'àn.",
      "ru": "Они разработали новую рекламную концепцию.",
      "note": "广告 (guǎnggào) — реклама · 方案 (fāng'àn) — план, концепция"
    }
  ],
  "footer_note": "策划 — разработка и организация; 婚礼策划师 — свадебный организатор; 活动策划 — event-менеджмент · HSK 6 (hsk2.0-L6)"
}
