{
  "hanzi": "嘴唇",
  "pinyin": "zuǐ chún",
  "meaning_ru": "губы",
  "meaning_en": "lips",
  "characters": [
    {
      "hz": "嘴",
      "py": "zuǐ",
      "gloss": "рот",
      "role": "орган"
    },
    {
      "hz": "唇",
      "py": "chún",
      "gloss": "губа",
      "role": "уточнение — именно губы, а не рот целиком"
    }
  ],
  "radicals": [
    {
      "hz": "口",
      "name": "kǒu — рот",
      "note": "В основе 唇 — рот 口 снизу, а сверху 辰 (chén) даёт звук. Рот есть в обоих иероглифах — слово буквально «рот-губы»"
    }
  ],
  "deep_dive": "<p><strong>嘴唇</strong> — «рот-губы», что логично: 嘴 это рот в целом, 唇 — именно губы. Вместе они точнее, чем каждое слово по отдельности.</p><p>В художественном языке и описании внешности 嘴唇 очень частое слово: 红嘴唇 (красные губы), 嘴唇干 (губы сухие), 嘴唇动了动 (губы чуть шевельнулись). В косметике скажут 口红 (kǒuhóng) — помада (буквально «красный рот»), а не 嘴唇红.</p>",
  "situations": [
    {
      "title": "✦ Внешность",
      "setup": "Описываешь чью-то внешность.",
      "line": "她的嘴唇很漂亮。 — «У неё красивые губы.»"
    },
    {
      "title": "☁ Физическое состояние",
      "setup": "Замечаешь, что кожа на губах пересохла.",
      "line": "我的嘴唇很干，需要涂润唇膏。 — «Мои губы очень сухие, нужно нанести бальзам.»"
    }
  ],
  "examples": [
    {
      "cn": "他的{hl}嘴唇{/hl}因为冷天裂了。",
      "py": "tā de zuǐchún yīnwèi lěng tiān liè le.",
      "ru": "Его губы потрескались из-за холодной погоды.",
      "note": "裂 (liè) — трескаться"
    },
    {
      "cn": "她抿了抿{hl}嘴唇{/hl}，没有说话。",
      "py": "tā mǐn le mǐn zuǐchún, méiyǒu shuōhuà.",
      "ru": "Она поджала губы и ничего не сказала.",
      "note": "抿 (mǐn) — слегка сжать, поджать (губы)"
    },
    {
      "cn": "{hl}嘴唇{/hl}干了要多喝水。",
      "py": "zuǐchún gān le yào duō hē shuǐ.",
      "ru": "Если губы сухие, нужно пить больше воды."
    }
  ],
  "footer_note": "嘴唇 — «рот-губы» · помада по-китайски 口红 (kǒuhóng), букв. «красный рот» · HSK 6 (hsk2.0-L6)"
}
