{
  "hanzi": "叼",
  "pinyin": "diāo",
  "meaning_ru": "держать в зубах (папиросу, кость — что-то зажатое уголком рта)",
  "meaning_en": "to hold in one's mouth (a cigarette, a bone — clenched at the corner)",
  "radicals": [
    {
      "hz": "口",
      "name": "kǒu — рот",
      "note": "Левая часть 叼 — рот, и это весь смысл: что-то держат именно ртом, зубами. Правая часть 刁 даёт звук и образ чего-то хитро поддетого"
    }
  ],
  "deep_dive": "<p>叼 — это очень конкретный жест: <strong>держать что-то во рту, не проглатывая</strong>. Сигарета, трубка, соломинка, кость — всё, что торчит из угла рта или зажато зубами.</p><p>Образ, который моментально понимают все: пёс с костью бежит через двор — это 叼着骨头 (diāo zhe gǔtou). Или дедушка с незажжённой папиросой в зубах — тоже 叼 着烟。</p><p>Слово совсем бытовое, но очень живое — его используют и о людях, и о животных. В литературе оно создаёт мгновенную картинку без лишних слов.</p>",
  "situations": [
    {
      "title": "✦ Пёс",
      "setup": "Собака несёт добычу.",
      "line": "狗叼着一块骨头跑了。 — «Пёс убежал с костью в зубах.»"
    },
    {
      "title": "☁ Сигарета",
      "setup": "Описываешь человека, курящего небрежно.",
      "line": "他嘴里叼着一根烟。 — «У него в зубах торчала сигарета.»"
    }
  ],
  "examples": [
    {
      "cn": "狗{hl}叼{/hl}着骨头跑了。",
      "py": "Gǒu diāo zhe gǔtou pǎo le.",
      "ru": "Пёс убежал с костью в зубах.",
      "note": "骨头 (gǔtou) — кость"
    },
    {
      "cn": "他嘴里{hl}叼{/hl}着一根烟。",
      "py": "Tā zuǐ lǐ diāo zhe yì gēn yān.",
      "ru": "У него в зубах торчала сигарета.",
      "note": "嘴 (zuǐ) — рот · 烟 (yān) — сигарета"
    },
    {
      "cn": "猫{hl}叼{/hl}着一只小鸟回来了。",
      "py": "Māo diāo zhe yì zhī xiǎo niǎo huí lái le.",
      "ru": "Кошка вернулась с птицей в зубах.",
      "note": "猫 (māo) — кошка · 鸟 (niǎo) — птица"
    }
  ],
  "footer_note": "叼 — держать в зубах · HSK 6 (hsk2.0-L6)"
}