{
 "hanzi": "公正",
 "pinyin": "gōng zhèng",
 "meaning_ru": "справедливый, беспристрастный; честный (без перекосов в чью-то пользу)",
 "meaning_en": "just; fair; impartial; even-handed",
 "characters": [
  {
   "hz": "公",
   "py": "gōng",
   "gloss": "общий, для всех",
   "role": "беспристрастность"
  },
  {
   "hz": "正",
   "py": "zhèng",
   "gloss": "прямой, правильный",
   "role": "смысловая основа"
  }
 ],
 "deep_dive": "<p>Буквально <strong>«общее + прямое»</strong>: судить так, чтобы было прямо и одинаково для всех, без поблажек своим. 公 несёт идею «для всех, открыто», 正 — «прямо, ровно». Вместе — беспристрастность судьи, который не клонится ни в одну сторону.</p><p>Близкое 公平 (gōngpíng) — про «честные, равные условия» (равный старт). А 公正 — скорее про честность решения, оценки, суда. Судья 公正; правила игры 公平.</p>",
 "situations": [
  {
   "title": "✦ О судье",
   "setup": "Хвалишь того, кто судил по-честному.",
   "line": "这位法官很公正。 — «Этот судья очень справедлив.»"
  }
 ],
 "examples": [
  {
   "cn": "我们需要一个{hl}公正{/hl}的决定。",
   "py": "wǒmen xūyào yí ge gōngzhèng de juédìng.",
   "ru": "Нам нужно справедливое решение.",
   "note": "决定 (juédìng) — решение"
  },
  {
   "cn": "他对每个人都很{hl}公正{/hl}。",
   "py": "tā duì měi ge rén dōu hěn gōngzhèng.",
   "ru": "Он ко всем относится беспристрастно."
  },
  {
   "cn": "法律应该{hl}公正{/hl}。",
   "py": "fǎlǜ yīnggāi gōngzhèng.",
   "ru": "Закон должен быть справедливым.",
   "note": "法律 (fǎlǜ) — закон"
  }
 ],
 "footer_note": "公正 — про честность суждения; 公平 — про равные условия · HSK 6 (hsk2.0-L6)"
}
